cake_crop_id,crop_file_name,shape,dominant_color,visual_style,lettering_type,board_lettering,border_type,cream_decoration,topping_decoration,character_type,text_presence,memo
4,_onyourday_1667207242_2961071421200629117_12861674625_cake_1.jpg,원형,화이트|핑크|블루|옐로우|블랙|브라운,캐릭터,중앙레터링,있음,크림테두리,하트|꽃|리본,진주,사람,있음,"케이크 중심에 사람 얼굴 캐릭터와 글자가 있음. 가장자리에 붉은 하트 크림장식과 옐로우 꽃, 진주 크림 장식이 있음."
5,_onyourday_1667294897_2961806726807664337_12861674625_cake_1.jpg,하트,화이트,레터링중심,중앙레터링,없음,없음,없음,없음,없음,있음,"하트 모양의 흰색 케이크 위에 다채로운 색상의 레터링이 중앙에 배치됨. 크림 장식, 테두리, 토핑 장식은 없음."
6,_onyourday_1667381361_2962532038948193892_12861674625_cake_1.jpg,하트,화이트|옐로우|그린,심플,중앙레터링,없음,없음,없음,진주,없음,있음,"하트 모양의 케이크로 크림에 그린, 옐로우, 화이트 색상이 있으며 진주 토핑이 있고 중앙에 레터링이 있음"
7,_onyourday_1667466914_2963249708203170261_12861674625_cake_1.jpg,하트,판단불가,판단불가,중앙레터링,없음,없음,없음,없음,없음,있음,케이크 표면이 빨간색이지만 조명과 이미지로 정확한 색상 판별 어려움
8,_onyourday_1667634022_2964651511566253430_12861674625_cake_1.jpg,원형,블루,캐릭터,중앙레터링,없음,없음,없음,없음,기타캐릭터,있음,"케이크 본체가 블루 바탕이며 ""짱구"" 캐릭터 얼굴과 중앙에 흰색 레터링이 있음. 크림 데코나 보더는 없음."
